<?xml version="1.0"?>
<AccessRights xmlns:xsi="http://www.w3.org/2001/XMLSchema-instance" xsi:noNamespaceSchemaLocation=".\Configuration\XSD\AccessRights.xsd">
  <NavigationRights>
    <NavigationArea>
      <Name>Root.ROOT_SETUP.PROCESS.BP_SCENARIOS.IsVisible</Name>
      <Level>0</Level>
    </NavigationArea>
    <NavigationArea>
      <Name>Root.ROOT_SETUP.PROCESS.BP_SCENARIOS_CONFIGURATION.SETUP_GROUPS_DEFINITION_EDIT_SCENARIO_GROUP.IsEnabled</Name>
      <Level>0</Level>
    </NavigationArea>
    <NavigationArea>
      <Name>Root.ROOT_ALARMS.ALARMS_HISTORY.ALARMS_RELOAD.IsEnabled</Name>
      <Level>3</Level>
    </NavigationArea>
    <NavigationArea>
      <Name>Root.ROOT_MAIN.ROOT_MAIN_EQUIPMENT.EQUIPMENT_RESET.IsEnabled</Name>
      <Level>0</Level>
    </NavigationArea>
    <NavigationArea>
      <Name>Root.ROOT_SETUP.MENU_APPLICATION.BP_ACCESSRIGHTS.S_SETUP_ACCESSRIGHTS_RESTORE.IsVisible</Name>
      <Level>0</Level>
    </NavigationArea>
    <NavigationArea>
      <Name>Root.ROOT_MAIN.ROOT_MAIN_EQUIPMENT.IsEnabled</Name>
      <Level>0</Level>
    </NavigationArea>
    <NavigationArea>
      <Name>Root.ROOT_MAINTENANCE.BP_SCENARIO_MANAGER.IsVisible</Name>
      <Level>0</Level>
    </NavigationArea>
    <NavigationArea>
      <Name>Root.ROOT_MAIN.ROOT_MAIN_EQUIPMENT.EQUIPMENT_ABORT.IsEnabled</Name>
      <Level>0</Level>
    </NavigationArea>
    <NavigationArea>
      <Name>TITLE_PANEL_CONTROL_COMMAND.IsVisible</Name>
      <Level>0</Level>
    </NavigationArea>
    <NavigationArea>
      <Name>Root.ROOT_LOGS.TRACE VIEWER.S_DATALOG_TRACES_CLEARALL.IsVisible</Name>
      <Level>0</Level>
    </NavigationArea>
    <NavigationArea>
      <Name>Root.ROOT_SETUP.PROCESS.BP_PROCESS_PROGRAM_CONFIG.SETUP_GROUPS_DEFINITION_DELETE_RECIPE_GROUP.IsVisible</Name>
      <Level>0</Level>
    </NavigationArea>
    <NavigationArea>
      <Name>SETUP_UNDO_CHANGES_COMMAND.IsVisible</Name>
      <Level>0</Level>
    </NavigationArea>
    <NavigationArea>
      <Name>Root.ROOT_ALARMS.IsEnabled</Name>
      <Level>0</Level>
    </NavigationArea>
    <NavigationArea>
      <Name>Root.ROOT_SETUP.PROCESS.IsVisible</Name>
      <Level>0</Level>
    </NavigationArea>
    <NavigationArea>
      <Name>Root.ROOT_RECIPES.IsVisible</Name>
      <Level>0</Level>
    </NavigationArea>
    <NavigationArea>
      <Name>Root.ROOT_SETUP.PROCESS.BP_SCENARIOS_CONFIGURATION.SETUP_GROUPS_DEFINITION_ADD_SCENARIO_GROUP.IsVisible</Name>
      <Level>0</Level>
    </NavigationArea>
    <NavigationArea>
      <Name>ToolManager.RapidColor.IsEnabled</Name>
      <Level>0</Level>
    </NavigationArea>
    <NavigationArea>
      <Name>Root.ROOT_MAIN.ROOT_MAIN_EQUIPMENT.ResetCommand.IsEnabled</Name>
      <Level>0</Level>
    </NavigationArea>
    <NavigationArea>
      <Name>Root.ROOT_MAINTENANCE.BP_SCENARIO_SEQUENCER.SCENARIO_EXECUTION_CONFIGURATION.UncheckedCommand.IsVisible</Name>
      <Level>0</Level>
    </NavigationArea>
    <NavigationArea>
      <Name>Root.ROOT_DIAGNOSTICS.TRACEVIEWER_SCROLL_TO_END.CheckedCommand.IsEnabled</Name>
      <Level>0</Level>
    </NavigationArea>
    <NavigationArea>
      <Name>Root.ROOT_GEM.MENU_GEM_DATA_DICTIONARY.GEMPANELS_DATA_VARIABLES.GEMPANELS_REFRESH.IsEnabled</Name>
      <Level>0</Level>
    </NavigationArea>
    <NavigationArea>
      <Name>Root.ROOT_DIAGNOSTICS.TRACEVIEWER_SCROLL_TO_END.UncheckedCommand.IsVisible</Name>
      <Level>0</Level>
    </NavigationArea>
    <NavigationArea>
      <Name>Root.ROOT_GEM.GEM_JOBSMENU.IsEnabled</Name>
      <Level>0</Level>
    </NavigationArea>
    <NavigationArea>
      <Name>Root.ROOT_HELP.MENU_DEVELOPERS.BP_SAMPLE.IsVisible</Name>
      <Level>0</Level>
    </NavigationArea>
    <NavigationArea>
      <Name>Root.ROOT_SETUP.PROCESS.BP_SCENARIOS_CONFIGURATION.SETUP_GROUPS_DEFINITION_ADD_SCENARIO_GROUP.IsEnabled</Name>
      <Level>0</Level>
    </NavigationArea>
    <NavigationArea>
      <Name>Root.ROOT_SETUP.MENU_APPLICATION.ROOT_ALARMS.SAVE_COMMAND.IsEnabled</Name>
      <Level>0</Level>
    </NavigationArea>
    <NavigationArea>
      <Name>Root.ROOT_MAINTENANCE.BP_COMMUNICATION_VISUALIZER.TRACEVIEWER_SCROLL_TO_END.UncheckedCommand.IsEnabled</Name>
      <Level>0</Level>
    </NavigationArea>
    <NavigationArea>
      <Name>Root.ROOT_MAINTENANCE.BP_COMMUNICATION_VISUALIZER.TRACEVIEWER_SCROLL_TO_END.IsEnabled</Name>
      <Level>0</Level>
    </NavigationArea>
    <NavigationArea>
      <Name>Root.ROOT_LOGS.DATALOG.S_DATALOG_TRACES_CLEARALL.IsEnabled</Name>
      <Level>0</Level>
    </NavigationArea>
    <NavigationArea>
      <Name>Root.ROOT_ALARMS.BP_ALARM_ANALYSIS.ALARM_ANALYSIS_RELOAD.IsVisible</Name>
      <Level>0</Level>
    </NavigationArea>
    <NavigationArea>
      <Name>Root.ROOT_GEM.GEM_JOBSMENU.CJ_HOQ.IsEnabled</Name>
      <Level>0</Level>
    </NavigationArea>
    <NavigationArea>
      <Name>Root.ROOT_TRACES.TRACEVIEWER_PAUSE_RESUME.TRACEVIEWER_PAUSE.IsEnabled</Name>
      <Level>0</Level>
    </NavigationArea>
    <NavigationArea>
      <Name>Root.ROOT_LOGS.Old DATALOG.S_DATALOG_FILTER_APPLY.IsVisible</Name>
      <Level>0</Level>
    </NavigationArea>
    <NavigationArea>
      <Name>Root.ROOT_SETUP.MENU_APPLICATION.BP_ACCESSRIGHTS.SAVE_COMMAND.IsEnabled</Name>
      <Level>0</Level>
    </NavigationArea>
    <NavigationArea>
      <Name>Root.ROOT_MAINTENANCE.BP_SAMPLE.IsVisible</Name>
      <Level>0</Level>
    </NavigationArea>
    <NavigationArea>
      <Name>Root.ROOT_RECIPES.BP_RECIPE_LIBRARY.Edit.IsVisible</Name>
      <Level>0</Level>
    </NavigationArea>
    <NavigationArea>
      <Name>Root.ROOT_GEM.BP_CARRIERS.CARRIERS_EDIT.IsEnabled</Name>
      <Level>0</Level>
    </NavigationArea>
	<NavigationArea>
		<Name>Root.ROOT_MAIN.ROOT_MAIN_EQUIPMENT.EQUIPMENT_PM_ABORT_RECIPE.IsVisible</Name>
		<Level>0</Level>
	</NavigationArea>
	<NavigationArea>
		<Name>Root.ROOT_MAIN.ROOT_MAIN_EQUIPMENT.EQUIPMENT_PM_ABORT_RECIPE.IsEnabled</Name>
		<Level>3</Level>
	</NavigationArea>
    <NavigationArea>
      <Name>Root.BP_PROCESS.DATAFLOW_ENGINEERING_MODE.IsVisible</Name>
      <Level>0</Level>
    </NavigationArea>
    <NavigationArea>
      <Name>Root.ROOT_SETUP.Process.IsVisible</Name>
      <Level>0</Level>
    </NavigationArea>
    <NavigationArea>
      <Name>Root.ROOT_MAIN.ROOT_MAIN_PRODUCTION.IsVisible</Name>
      <Level>0</Level>
    </NavigationArea>
    <NavigationArea>
      <Name>Root.ROOT_LOGS.S_DATALOG_TRACES_CLEARALL.IsEnabled</Name>
      <Level>0</Level>
    </NavigationArea>
    <NavigationArea>
      <Name>Root.BP_RESULTS.IsVisible</Name>
      <Level>0</Level>
    </NavigationArea>
    <NavigationArea>
      <Name>Root.ROOT_MAIN.ROOT_MAIN_EQUIPMENT.EQUIPMENT_ABORT.IsVisible</Name>
      <Level>0</Level>
    </NavigationArea>
    <NavigationArea>
      <Name>Root.ROOT_LOGS.DATALOG.S_DATALOG_TRACES_PAUSE_RESUME.IsVisible</Name>
      <Level>0</Level>
    </NavigationArea>
    <NavigationArea>
      <Name>Root.ROOT_HELP.MENU_DEVELOPERS.BP_SAMPLE.IsEnabled</Name>
      <Level>0</Level>
    </NavigationArea>
    <NavigationArea>
      <Name>Root.ROOT_SETUP.MENU_APPLICATION.BP_ACCESSRIGHTS.SAVE_COMMAND.IsVisible</Name>
      <Level>0</Level>
    </NavigationArea>
    <NavigationArea>
      <Name>Root.ROOT_SETUP.MENU_APPLICATION.BP_APP_CONFIG.UNDO_COMMAND.IsEnabled</Name>
      <Level>0</Level>
    </NavigationArea>
    <NavigationArea>
      <Name>Root.ROOT_GEM.GEM_JOBSMENU.GEM_PAUSE.IsVisible</Name>
      <Level>0</Level>
    </NavigationArea>
    <NavigationArea>
      <Name>Root.ROOT_SETUP.MENU_APPLICATION.BP_ACCESSRIGHTS.UNDO_COMMAND.IsEnabled</Name>
      <Level>0</Level>
    </NavigationArea>
    <NavigationArea>
      <Name>Root.ROOT_GEM.BP_CARRIERS.CARRIERS_RECREATE.IsVisible</Name>
      <Level>0</Level>
    </NavigationArea>
    <NavigationArea>
      <Name>Root.ROOT_GEM.SUB_TRACK.SUB_TRACK_COMPARE.CheckedCommand.IsEnabled</Name>
      <Level>0</Level>
    </NavigationArea>
    <NavigationArea>
      <Name>Root.ROOT_MAINTENANCE.BP_EQUIPMENT_HANDLING.EQUIPMENT_LOAD_PM.IsEnabled</Name>
      <Level>0</Level>
    </NavigationArea>
    <NavigationArea>
      <Name>Root.ROOT_MAINTENANCE.BP_SCENARIO_LIBRARY.SETUP_SAVE_CONFIG_COMMAND.IsVisible</Name>
      <Level>0</Level>
    </NavigationArea>
    <NavigationArea>
      <Name>Root.ROOT_HELP.MENU_DEVELOPERS.MENU_GUI_COMPONENTS.BP_NAVIGATION.IsEnabled</Name>
      <Level>0</Level>
    </NavigationArea>
    <NavigationArea>
      <Name>Root.ROOT_GEM.SUB_TRACK.SUB_TRACK_COMPARE.CheckedCommand.IsVisible</Name>
      <Level>0</Level>
    </NavigationArea>
    <NavigationArea>
      <Name>Root.ROOT_MAIN.ROOT_MAIN_PRODUCTION.RUN_PROG_CMD.IsEnabled</Name>
      <Level>0</Level>
    </NavigationArea>
    <NavigationArea>
      <Name>Root.ROOT_MAINTENANCE.BP_COMMUNICATION_VISUALIZER.TRACEVIEWER_SCROLL_TO_END.IsVisible</Name>
      <Level>0</Level>
    </NavigationArea>
    <NavigationArea>
      <Name>TITLE_PANEL_EQUIPMENT_COMMAND.IsEnabled</Name>
      <Level>0</Level>
    </NavigationArea>
    <NavigationArea>
      <Name>Root.ROOT_LOGS.S_DATALOG_TRACES_PAUSE_RESUME.S_DATALOG_TRACES_PAUSE.IsVisible</Name>
      <Level>0</Level>
    </NavigationArea>
    <NavigationArea>
      <Name>Root.ROOT_GEM.GEMPANELS_STATUS_VARIABLES.IsEnabled</Name>
      <Level>0</Level>
    </NavigationArea>
    <NavigationArea>
      <Name>Root.ROOT_GEM.BP_SMN_VIEWER.SEQUENCE_LOG_CLEAR.IsVisible</Name>
      <Level>0</Level>
    </NavigationArea>
    <NavigationArea>
      <Name>Root.ROOT_GEM.GEM_JOBSMENU.GEM_ADD_JOB.IsEnabled</Name>
      <Level>0</Level>
    </NavigationArea>
    <NavigationArea>
      <Name>Root.ROOT_SETUP.Process.BP_PROCESS_PROGRAM_CONFIG.IsVisible</Name>
      <Level>0</Level>
    </NavigationArea>
    <NavigationArea>
      <Name>Root.ROOT_GEM.BP_LOADPORTS_OVERVIEW.CARRIERS_CANCEL_RESERVATION.IsEnabled</Name>
      <Level>0</Level>
    </NavigationArea>
    <NavigationArea>